{
  "date": "2026-06-14",
  "repo": "vllm-project/vllm",
  "generated_at": "2026-06-15T03:23:42.940790+08:00",
  "daily_summary": "当日变更涵盖了多个方面：修复了多模态模型与prompt_embeds结合使用时的bug，优化了多模态特征查找性能，为AMD ROCm平台新增了W4A16 FlyDSL MoE内核支持，为Intel XPU平台扩展了W4A16 MoE的量化方案支持，修复了DCP（Deep Context Parallelism）在CUDA Graph下的非法内存访问问题，新增了动态投机解码（Dynamic Speculative Decoding）功能，修复了CUDA架构构建覆盖的缺口，并修复了Docker nightly镜像中Anthropic协议导入错误。此外，还简化了Model Runner V2的异步输出处理逻辑。",
  "sig_summaries": {
    "sig-model-performance": "SIG Model Performance 方向当日共 4 条变更。",
    "sig-ci": "SIG CI 方向当日共 2 条变更。",
    "sig-omni": "vLLM-Omni 方向当日共 1 条变更。",
    "sig-spec-decode": "SIG Spec Decode 方向当日共 1 条变更。",
    "sig-core": "SIG Core 方向当日共 1 条变更。"
  },
  "commits": [
    {
      "sha": "c621af16908f05270e033afd4237509902b7ba4d",
      "comment": "修复了多模态模型在使用prompt_embeds时的bug。当启用prompt_embeds且模型为多模态模型时，输入中某些位置携带预计算的prompt_embeds（标记为is_token_ids=False），而其他位置需要正常embed。原代码对所有输入调用embed_input_ids，会导致在prompt_embeds位置读取到占位符id（可能越界）。修复方案：使用torch.where根据is_token_ids掩码，对token id位置安全地embed，对prompt_embeds位置保留预计算值。同时在VllmConfig中增加了对async_scheduling与prompt_embeds+多模态组合的兼容性检查，若冲突则禁用async_scheduling。实现正确，风险较低。",
      "sig": "sig-omni",
      "sig_reason": "（启发式迁移）按变更文件路径归类，可用 analyze_commits.py --force 重新分析。",
      "tags": [
        "bugfix",
        "low-risk",
        "model-runner",
        "multimodal"
      ]
    },
    {
      "sha": "e2bf2b3d8475715f1b951b6e9f4020af2721db6e",
      "comment": "优化了Model Runner V2中多模态特征查找的性能。原代码在gather_mm_embeddings中遍历所有mm_features，对每个feature检查其位置是否在当前查询窗口内，使用break和continue控制流。优化后使用二分查找（get_mm_features_in_window）直接定位窗口内的feature范围，减少了不必要的遍历。这是一个纯性能优化，逻辑等价，风险极低。",
      "sig": "sig-model-performance",
      "sig_reason": "（启发式迁移）按变更文件路径归类，可用 analyze_commits.py --force 重新分析。",
      "tags": [
        "performance",
        "low-risk",
        "model-runner",
        "multimodal"
      ]
    },
    {
      "sha": "725c3bc808c6eb5a572bdb37ed8a84bd11aad24a",
      "comment": "为AMD ROCm平台（gfx950）新增了W4A16 FlyDSL MoE内核支持。这是一个大型变更，包含：1) 新增fused_flydsl_moe.py实现FlyDSL MoE前向计算，使用flydsl.compiler和aiter库；2) 新增compressed_tensors_moe_w4a16_flydsl.py实现权重格式转换（GPTQ int32 -> FlyDSL packed int4）；3) 在compressed_tensors_moe.py中新增条件分支，在满足特定条件（group_size=32, int4, gfx950, flydsl backend）时选择FlyDSL方法；4) 在routed_experts.py中注册新方法；5) 在KernelConfig中新增flydsl选项；6) 新增调优脚本和预调优配置文件；7) 新增测试用例。变更涉及多个模块，但仅影响ROCm平台，风险可控。",
      "sig": "sig-model-performance",
      "sig_reason": "（启发式迁移）按变更文件路径归类，可用 analyze_commits.py --force 重新分析。",
      "tags": [
        "feature",
        "performance",
        "medium-risk",
        "moe",
        "quantization",
        "rocm"
      ]
    },
    {
      "sha": "9548a1887fe14e553c5db2c2a76e59fa79fd3ef4",
      "comment": "为Intel XPU平台扩展了W4A16 MoE的量化方案支持。在XPUExperts类中新增对kInt4Static32（int4 group_size=32）量化方案的支持，与已有的kInt4Static方案并列。变更极小，仅修改了_supports_quant_scheme方法的返回值。风险极低。",
      "sig": "sig-model-performance",
      "sig_reason": "（启发式迁移）按变更文件路径归类，可用 analyze_commits.py --force 重新分析。",
      "tags": [
        "feature",
        "low-risk",
        "moe",
        "quantization",
        "xpu"
      ]
    },
    {
      "sha": "9fd737badcc5eaeb61fd1e7b894af02ba657f203",
      "comment": "修复了DCP（Deep Context Parallelism）在full CUDA Graph模式下的非法内存访问问题。问题根因：_dcp_a2a_send_recv_buffers函数使用WorkspaceManager分配共享缓冲区，但full CUDA Graph会固化缓冲区地址。当eager模式下的a2a操作需要更大batch时，WorkspaceManager会重新分配缓冲区，导致之前captured的graph中的地址变为悬空指针，在replay时引发非法内存访问。修复方案：直接使用torch.empty分配私有缓冲区，这些缓冲区存在于graph的私有内存池中，生命周期与graph一致。同时移除了对WorkspaceManager的依赖。这是一个重要的bug修复，风险较低。",
      "sig": "sig-model-performance",
      "sig_reason": "（启发式迁移）按变更文件路径归类，可用 analyze_commits.py --force 重新分析。",
      "tags": [
        "bugfix",
        "low-risk",
        "attention",
        "cuda-graph"
      ]
    },
    {
      "sha": "4ef4492e9b7a5a7ba295da783d456d45db5eb9d6",
      "comment": "新增了动态投机解码（Dynamic Speculative Decoding）功能。核心思想：根据当前并发请求数（batch size）动态调整投机解码的K值（每个序列生成的draft token数），在batch size大时降低K以避免过大的有效batch size（BS*K）导致性能下降，在batch size小时提高K以充分利用空闲计算资源。变更包含：1) 新增vllm/v1/spec_decode/dynamic/utils.py实现调度表构建和验证逻辑；2) 在SpeculativeConfig中新增num_speculative_tokens_per_batch_size配置项；3) 修改Scheduler，在schedule()时根据当前batch size从调度表中查找最优K值并输出到SchedulerOutput；4) 修改所有投机解码器的propose接口，新增num_speculative_tokens参数；5) 修改GPUModelRunner的propose_draft_token_ids方法，传递动态K值；6) 修改async_scheduler以支持动态K值；7) 在VllmConfig中增加cudagraph_mode自动降级逻辑（动态SD不兼容full CUDA Graph，强制使用PIECEWISE）；8) 新增测试和文档。这是一个较大的功能变更，涉及多个模块，但设计清晰，风险可控。",
      "sig": "sig-spec-decode",
      "sig_reason": "（启发式迁移）按变更文件路径归类，可用 analyze_commits.py --force 重新分析。",
      "tags": [
        "feature",
        "medium-risk",
        "speculative-decoding",
        "scheduler"
      ]
    },
    {
      "sha": "78e7293bb157498d23780891cc4ef365a31772b6",
      "comment": "修复了CUDA架构构建覆盖的缺口。主要变更：1) 从全局TORCH_CUDA_ARCH_LIST中移除+PTX标志，改为在需要PTX的特定kernel的CMake arch列表中本地添加；2) 在CMakeLists.txt中重构了多个kernel的arch选择逻辑，将源文件列表变量名规范化（如SRCS改为SCALED_MM_SM90_SRCS），并修复了arch范围（如为DSV3_FUSED_A_GEMM、FP4等kernel添加了SM12x支持）；3) 修复了mxfp4_experts_quant.cu中的条件编译问题，添加了CUDA版本检查和SM支持检查；4) 修复了qutlass.cmake中SM100/SM120 arch选择逻辑；5) 更新了Dockerfile和build脚本中的arch列表；6) 在_custom_ops.py中新增mxfp4_experts_quant_supported函数。这是一个构建系统修复，风险中等。",
      "sig": "sig-ci",
      "sig_reason": "（启发式迁移）按变更文件路径归类，可用 analyze_commits.py --force 重新分析。",
      "tags": [
        "bugfix",
        "ci",
        "medium-risk",
        "build"
      ]
    },
    {
      "sha": "54bbf5166842932fa7abc34a14df850594daeb5e",
      "comment": "修复了Docker nightly镜像中Anthropic协议导入错误。问题根因：Docker构建缓存机制导致wheel安装层未被正确缓存失效，当协议模块新增符号（如AnthropicOutputConfig）时，旧wheel被缓存命中导致运行时导入错误。修复方案：1) 在构建阶段记录wheel的sha256校验和；2) 在安装阶段先复制校验和文件（仅几字节）到镜像中，使wheel变更时该层缓存失效；3) 新增测试验证Anthropic协议导出符号可导入。这是一个构建系统修复，风险较低。",
      "sig": "sig-ci",
      "sig_reason": "（启发式迁移）按变更文件路径归类，可用 analyze_commits.py --force 重新分析。",
      "tags": [
        "bugfix",
        "ci",
        "low-risk",
        "build",
        "docker"
      ]
    },
    {
      "sha": "cf027b86af71251a8e937a56751636686b4429e4",
      "comment": "简化了Model Runner V2的异步输出处理逻辑。原代码在sample_tokens和pool方法中根据use_async_scheduling标志决定返回AsyncModelRunnerOutput还是其内部output。简化后统一返回AsyncModelRunnerOutput，由调用方（uniproc_executor）在需要时调用get_output()获取实际output。同时修复了multiproc_executor中异常处理逻辑：将handle_output调用移到try块内，确保异常时也能正确处理output。这是一个重构，逻辑等价，风险较低。",
      "sig": "sig-core",
      "sig_reason": "（启发式迁移）按变更文件路径归类，可用 analyze_commits.py --force 重新分析。",
      "tags": [
        "refactor",
        "low-risk",
        "model-runner"
      ]
    }
  ]
}