{
  "date": "2026-07-19",
  "repo": "vllm-project/vllm",
  "generated_at": "2026-07-20T03:02:28.684204+08:00",
  "daily_summary": "当日变更涉及四个主要方向：1) 修复了已移除的 pooling 参数（normalize、score、encode）的拒绝逻辑，确保用户在使用这些已废弃参数时能收到明确的错误提示；2) 重构了 StructuredOutputsParams 的创建逻辑，将 response_format 到 structured_outputs 的转换逻辑从 to_sampling_params 方法中提取为独立的 extract_structured_outputs 方法，提高了代码的可维护性和可测试性；3) 为 MLA 模型引入了 MRV2 虚拟批次 PCP（Prefill Context Parallelism）支持，这是一个大型功能变更，涉及调度器、KV Cache 管理、注意力后端、模型执行器等多个模块的深度修改；4) 为多模态视觉编码器增加了自动回退到数据并行（DP）的能力，当注意力头数不能被 TP 大小整除时自动使用 DP。",
  "sig_summaries": {
    "sig-core": "SIG Core 方向当日共 3 条变更。",
    "sig-omni": "vLLM-Omni 方向当日共 1 条变更。",
    "sig-ci": "SIG CI 方向当日共 1 条变更。"
  },
  "commits": [
    {
      "sha": "e6d1310b2ac52e56e266450693af9de12a871a51",
      "comment": "该 commit 修复了已移除的 pooling 参数的拒绝逻辑。变更涉及多个文件：在 vllm/tasks.py 中新增了 check_removed_pooling_task 函数和 _REMOVED_POOLING_TASK_MESSAGES 字典，用于检查已移除的 pooling task（score、encode）；在 vllm/config/pooler.py 的 PoolerConfig 中新增了 reject_removed_parameters 模型验证器，拒绝 normalize 参数和已移除的 task；在 vllm/pooling_params.py 的 PoolingParams 中新增了 check_removed_pooling_task 调用；在 vllm/entrypoints/pooling/base/protocol.py 中新增了 reject_removed_pooling_parameters 函数，并在 ClassificationRequest、EmbeddingRequest、PoolingRequest 类型别名中通过 BeforeValidator 应用该函数。测试方面新增了 test_removed_pooling_parameters 测试用例。实现方式是通过 pydantic 的 model_validator 和 BeforeValidator 在数据验证阶段拦截已移除的参数。潜在风险较低，主要是确保用户在使用已废弃参数时能收到明确的错误提示，而不是静默忽略或产生意外行为。",
      "sig": "sig-core",
      "sig_reason": "（启发式迁移）按变更文件路径归类，可用 analyze_commits.py --force 重新分析。",
      "tags": [
        "bugfix",
        "low-risk",
        "pooling",
        "entrypoints"
      ]
    },
    {
      "sha": "ac5f38a0f7af29cb5bc15a1e73623922d9832500",
      "comment": "该 commit 重构了 StructuredOutputsParams 的创建逻辑。变更涉及多个协议文件：在 vllm/entrypoints/openai/engine/protocol.py 中新增了 structured_outputs_from_response_format 函数，将 response_format 到 structured_outputs 的转换逻辑提取为独立函数；在 chat_completion/protocol.py、completion/protocol.py、responses/protocol.py 中分别新增了 extract_structured_outputs 方法，并在 to_sampling_params 中调用该方法替代原有的内联逻辑。实现方式是将重复的 response_format 解析逻辑集中到 structured_outputs_from_response_format 函数中，每个请求类型通过 extract_structured_outputs 方法调用该函数。潜在风险较低，主要是代码重构，不改变功能行为。测试方面新增了 test_text_format_json_object_enables_structured_outputs 测试用例验证 json_object 格式的正确处理。",
      "sig": "sig-core",
      "sig_reason": "（启发式迁移）按变更文件路径归类，可用 analyze_commits.py --force 重新分析。",
      "tags": [
        "refactor",
        "low-risk",
        "structured-output",
        "entrypoints"
      ]
    },
    {
      "sha": "b6ff8a2f509cc7ac9c58176f5115a836aa1e08bd",
      "comment": "该 commit 为 MLA 模型引入了 MRV2 虚拟批次 PCP（Prefill Context Parallelism）支持，是一个大型功能变更。核心变更包括：1) 新增 vllm/v1/worker/gpu/pcp_manager.py 文件，实现了 PCPManager 类，负责将全局 batch 分区为 rank-local DualChunkSwap 行，并在采样前恢复全局 batch 形状；2) 修改 vllm/v1/attention/backend.py，在 AttentionBackend 中新增 supports_pcp 类方法，在 AttentionImplBase 中新增 supports_pcp 属性；3) 修改 vllm/v1/attention/backends/utils.py 中的 split_decodes_and_prefills 函数，新增 treat_short_extends_as_decodes 参数；4) 修改 vllm/v1/attention/selector.py 中的 AttentionSelectorConfig，新增 use_pcp 字段；5) 修改 vllm/v1/worker/gpu/model_runner.py，集成 PCPManager 到模型执行流程；6) 修改 vllm/v1/worker/gpu/block_table.py 中的 gather_block_tables 和 compute_slot_mappings 方法，新增 out/out_ptrs 参数支持输出到外部缓冲区；7) 修改 vllm/v1/worker/cp_utils.py，将 get_total_cp_world_size 重构为 get_kv_cache_shard_count，移除 PCP 对 KV cache shard 的影响；8) 修改 vllm/config/parallel.py 中的 ParallelConfig 验证逻辑，调整 DCP 和 PCP 的约束关系；9) 修改 vllm/distributed/parallel_state.py 中的 DCP 组初始化逻辑，支持 PCP 轴上的 DCP；10) 修改 vllm/v1/core/kv_cache_coordinator.py、kv_cache_utils.py、single_type_kv_cache_manager.py 等文件，移除 PCP 对 block_size 的缩放；11) 修改 vllm/model_executor/layers/attention/mla_attention.py，集成 PCP 的 cache 输入收集和 decode 输出恢复；12) 新增 vllm/model_executor/layers/attention/pcp.py 文件，实现 PCP 相关的 cache 输入收集和 decode 输出恢复函数；13) 修改 vllm/v1/attention/backends/mla/indexer.py 中的 DeepseekV32IndexerBackend，支持 PCP；14) 修改 vllm/model_executor/layers/fused_moe/config.py 和 runner/moe_runner.py，支持 PCP 下的 all2all 通信；15) 修改 vllm/model_executor/layers/sparse_attn_indexer.py，支持 PCP 下的 indexer 操作；16) 修改 vllm/v1/worker/gpu/model_states/default.py，传递 is_prefilling 信息；17) 修改 vllm/v1/worker/gpu/attn_utils.py 中的 build_attn_metadata，支持 is_prefilling 参数；18) 修改 vllm/v1/worker/block_table.py 中的 compute_slot_mapping，移除 PCP 对 slot mapping 的影响；19) 修改 vllm/v1/kv_cache_interface.py 中的 AttentionSpec，移除 PCP 对 max_num_blocks_per_req 的影响；20) 修改 vllm/v1/simple_kv_offload/manager.py，移除 PCP 对 cp_world_size 的影响；21) 修改 vllm/config/vllm.py，允许 MLA 模型使用 PCP；22) 修改 vllm/distributed/device_communicators/all2all.py 和 base_device_communicator.py，支持 PCP 下的 all2all 通信；23) 修改 vllm/distributed/kv_transfer/kv_connector/v1/offloading/config.py，移除 PCP 对 tokens_per_block 的影响。实现方式是通过 PCPManager 在模型执行前将全局 batch 分区为 rank-local 批次，每个 rank 只处理部分 token，在注意力计算后通过 all_gather 恢复完整输出。潜在风险较高，因为涉及多个核心模块的深度修改，且 PCP 功能目前仅支持 MLA 模型，不支持 PP、MM、LoRA、spec decode 等特性。",
      "sig": "sig-core",
      "sig_reason": "（启发式迁移）按变更文件路径归类，可用 analyze_commits.py --force 重新分析。",
      "tags": [
        "feature",
        "high-risk",
        "attention",
        "model-runner",
        "scheduler",
        "kv-cache",
        "distributed",
        "parallelism"
      ]
    },
    {
      "sha": "9243e0124e5c5396213258b2fb6d6401ee8965e9",
      "comment": "该 commit 为多模态视觉编码器增加了自动回退到数据并行（DP）的能力。变更涉及 vllm/model_executor/models/vision.py 中的 is_vit_use_data_parallel 函数，新增了 num_heads 参数，当 num_heads 不为 None 且不能被 TP 大小整除时，自动返回 True（使用数据并行），并发出警告日志。同时修改了 kimi_k25.py 和 kimi_k25_vit.py 中的调用点，传入 num_heads 参数。实现方式是在 is_vit_use_data_parallel 函数中增加可选的 num_heads 参数，当传入该参数时检查注意力头数是否能被 TP 大小整除。潜在风险较低，主要是增强了视觉编码器的兼容性。",
      "sig": "sig-omni",
      "sig_reason": "（启发式迁移）按变更文件路径归类，可用 analyze_commits.py --force 重新分析。",
      "tags": [
        "feature",
        "low-risk",
        "multimodal",
        "vision"
      ]
    },
    {
      "sha": "df362b2d6d091771dbcc364b2fc96d17a78df274",
      "comment": "（自动判定）仅涉及 tests / docs / CI / 平台特化代码变更，不影响 vllm-ascend。",
      "sig": "sig-ci",
      "sig_reason": "（启发式迁移）按变更文件路径归类，可用 analyze_commits.py --force 重新分析。",
      "tags": [
        "chore"
      ]
    }
  ]
}