{
  "date": "2026-07-12",
  "repo": "vllm-project/vllm",
  "generated_at": "2026-07-13T03:01:53.799214+08:00",
  "daily_summary": "当日变更涉及多个方面：1) 新增 EC Connector 的传输参数支持，将 encoder cache 的跨节点传输参数（ec_transfer_params）贯穿整个协议栈（gRPC、Rust 客户端、Python 入口、调度器、引擎输出），实现 encoder cache 的 PD 分离部署；2) 修复 KV offload tiering 区域在 DP 副本下的命名冲突，使 engine_id 包含 DP rank 后缀；3) 修复 allreduce RMSNorm 量化融合 pass 中未检查输入与权重 dtype 一致性的 bug；4) 为 RLHF 开发 API 路由新增 /abort_requests 端点，支持批量中止请求；5) 优化 Qwen3.5/Next 模型在 MoE 层使用 reduce-scatter 替代 all-reduce，减少通信量；6) 支持投机解码中草稿模型的运行时权重更新；7) 支持混合模型（full attention + mamba align）的细粒度部分前缀缓存命中，包括调度器分块、部分尾部注册、CoW 处理等；8) 修复 LoRA 层中 ark_linear 基层的设备检测。",
  "sig_summaries": {
    "sig-core": "SIG Core 方向当日共 6 条变更。",
    "sig-ci": "SIG CI 方向当日共 3 条变更。",
    "sig-large-scale-serving": "SIG Large Scale Serving 方向当日共 1 条变更。",
    "sig-quantization": "SIG Quantization 方向当日共 1 条变更。",
    "sig-omni": "vLLM-Omni 方向当日共 1 条变更。"
  },
  "commits": [
    {
      "sha": "27c3e579f0e5f345a86e512e26e1231d3689931f",
      "comment": "（自动判定）仅涉及 tests / docs / CI / 平台特化代码变更，不影响 vllm-ascend。",
      "sig": "sig-ci",
      "sig_reason": "（启发式迁移）按变更文件路径归类，可用 analyze_commits.py --force 重新分析。",
      "tags": [
        "chore"
      ]
    },
    {
      "sha": "8df14cfc8c8a09b4e57f082e59593a3abce4ffb3",
      "comment": "该 commit 新增了 EC Connector（Encoder Cache Connector）的传输参数支持，用于 encoder cache 的 PD 分离部署。变更贯穿整个协议栈：1) gRPC proto 新增 ec_transfer_params 字段；2) Rust 客户端（engine-core-client、llm、chat、text、server）在 EngineCoreOutput、GenerateOutput、Finished、ChatEvent 等数据结构中新增 ec_transfer_params 字段并传递；3) Python 入口点（OpenAI、Anthropic、Responses、TokenInTokenOut）在请求和响应协议中新增 ec_transfer_params 字段；4) 调度器（Scheduler）的 _free_request 方法返回 ec_transfer_params，并在 update_from_output 中传递给 EngineCoreOutput；5) EngineCoreOutput 新增 ec_transfer_params 字段；6) 输出处理器（OutputProcessor）将 ec_transfer_params 传递给 RequestOutput；7) Request 类从 SamplingParams.extra_args 中读取 ec_transfer_params；8) 新增环境变量 VLLM_EC_SIDE_CHANNEL_HOST/PORT；9) Scheduler 接口新增 get_ec_connector 方法；10) 新增测试文件 test_ec_transfer_params.py。实现方式与已有的 kv_transfer_params 完全对称。潜在风险：ec_connector 为 None 时的日志警告可能被误触发；ec_transfer_params 在 Rust 和 Python 之间的序列化/反序列化一致性需要验证。",
      "sig": "sig-core",
      "sig_reason": "（启发式迁移）按变更文件路径归类，可用 analyze_commits.py --force 重新分析。",
      "tags": [
        "feature",
        "medium-risk",
        "scheduler",
        "kv-cache",
        "distributed",
        "entrypoints",
        "protocol"
      ]
    },
    {
      "sha": "370b678a028872e7c7def9aa18cfef3ab1fa750e",
      "comment": "（自动判定）仅涉及 tests / docs / CI / 平台特化代码变更，不影响 vllm-ascend。",
      "sig": "sig-ci",
      "sig_reason": "（启发式迁移）按变更文件路径归类，可用 analyze_commits.py --force 重新分析。",
      "tags": [
        "chore"
      ]
    },
    {
      "sha": "5c0c987c03593a1c05b8728fb265c94deb3d0a4c",
      "comment": "该 commit 修复了 KV offload tiering 区域在 DP（Data Parallel）副本下的命名冲突问题。变更将 SharedOffloadRegion 的 instance_id 参数重命名为 engine_id，并在 TieringSpec 中从 kv_transfer_config.engine_id 获取该值（该值在 Ray 和多进程路径下已包含 DP rank 后缀，如 _dp{rank}）。同时修复了 create_worker 中 rank 的计算方式，使用当前设备索引对 world_size 取模，确保在 DP 场景下 rank 映射到副本本地的 [0, world_size) 范围。潜在风险：engine_id 必须非 None 的断言可能在某些配置下失败；rank 取模计算假设设备索引连续且与 DP rank 对齐。",
      "sig": "sig-large-scale-serving",
      "sig_reason": "（启发式迁移）按变更文件路径归类，可用 analyze_commits.py --force 重新分析。",
      "tags": [
        "bugfix",
        "medium-risk",
        "kv-cache",
        "distributed"
      ]
    },
    {
      "sha": "5f8e73cb8b8d41f7a2a5168cddf5b772888fa991",
      "comment": "该 commit 修复了 allreduce RMSNorm 量化融合 pass 中的一个 bug。在 allreduce_rms_fusion.py 中，两个量化融合模式（静态量化和组量化）的 register_replacement 调用新增了 extra_check=_norm_input_weight_dtype_match 参数，确保融合操作仅在归一化层的输入和权重 dtype 匹配时执行。同时新增了 TestAllReduceGemmaRMSNormStaticQuantFP8Model 测试用例，验证 Gemma 风格的 RMSNorm（权重不参与梯度计算）在静态量化融合场景下的正确性。潜在风险：extra_check 可能增加编译时间；某些边缘 case 可能因 dtype 不匹配而无法融合，导致性能回退。",
      "sig": "sig-quantization",
      "sig_reason": "（启发式迁移）按变更文件路径归类，可用 analyze_commits.py --force 重新分析。",
      "tags": [
        "bugfix",
        "low-risk",
        "compilation",
        "performance"
      ]
    },
    {
      "sha": "83762b77b07e97c77f986e4bf5a9474952e47bb3",
      "comment": "该 commit 为 RLHF 开发 API 路由新增了 /abort_requests 端点。变更包括：1) Python 端在 rlhf/api_router.py 中新增 abort_requests 路由，支持空 request_ids（中止所有请求）和指定 request_ids 两种模式；2) Rust 端修改 abort_requests 路由，允许 request_ids 为空或缺失（此时中止所有 in-flight 请求）；3) Rust 端 InflightRequests 新增 all_internal_ids 方法；4) Llm::abort 方法在 external_ids 为空时调用 all_internal_ids；5) 更新文档。潜在风险：空 request_ids 中止所有请求的行为可能被误用；Python 端直接访问 AsyncLLM 的内部状态（request_states、parent_requests）存在耦合风险。",
      "sig": "sig-core",
      "sig_reason": "（启发式迁移）按变更文件路径归类，可用 analyze_commits.py --force 重新分析。",
      "tags": [
        "feature",
        "low-risk",
        "entrypoints",
        "rlhf"
      ]
    },
    {
      "sha": "a02984ed471488c0f0e8f73cab21be4325992d4c",
      "comment": "该 commit 优化了 Qwen3.5/Next 模型在 MoE 层的通信模式，将 all-reduce 替换为 reduce-scatter。变更包括：1) Qwen3NextDecoderLayer 新增 use_attn_reduce_scatter_for_moe 标志，当启用 sequence_parallel_moe 且 PP=1 且为 MoE 层时生效；2) 注意力层的 out_proj 设置 reduce_results=False，避免在注意力输出后立即 all-reduce；3) 在注意力输出后执行 reduce-scatter 将序列维度分片到各 TP rank；4) MoE 层接收已分片的输入（already_sequence_parallel=True），避免再次分片；5) MoE 输出后不再需要 all-gather；6) 在非 MoE 层或需要 aux_hidden_states 时，通过 _all_gather_hidden_and_residual 恢复完整序列。潜在风险：reduce-scatter 要求序列长度能被 TP world size 整除，代码通过 padding 处理；aux_hidden_states 的收集逻辑需要确保在正确的层索引处恢复完整序列。",
      "sig": "sig-core",
      "sig_reason": "（启发式迁移）按变更文件路径归类，可用 analyze_commits.py --force 重新分析。",
      "tags": [
        "performance",
        "medium-risk",
        "model-runner",
        "distributed",
        "qwen"
      ]
    },
    {
      "sha": "fc1c548093029f6487bbdc9c612995dfe7621a75",
      "comment": "该 commit 支持投机解码中草稿模型的运行时权重更新。变更包括：1) WeightTransferEngine 基类新增 set_weight_update_target 和 reset_weight_update_target 方法，允许在权重更新会话中切换目标模型；2) GPUModelRunner 新增 get_draft_model 方法，返回草稿模型（DraftModelSpeculator 或 drafter）；3) GPUWorker 新增 start_draft_weight_update 方法，调用 _start_weight_update(is_draft=True)，在启动权重更新前通过 _set_draft_weight_update_target 将 weight_transfer_engine 的目标设置为草稿模型；4) 权重更新完成后自动调用 reset_weight_update_target 恢复目标模型；5) SparseNCCLWeightTransferEngine 设置 supports_draft_weight_update=False；6) 新增 /start_draft_weight_update API 路由；7) 更新文档。潜在风险：草稿模型不存在或配置缺失时的错误处理；weight_transfer_engine 的状态管理（active 标志、异常恢复）需要确保正确。",
      "sig": "sig-core",
      "sig_reason": "（启发式迁移）按变更文件路径归类，可用 analyze_commits.py --force 重新分析。",
      "tags": [
        "feature",
        "medium-risk",
        "speculative-decoding",
        "distributed",
        "rlhf"
      ]
    },
    {
      "sha": "481e481be786c1ca3229e26aa34c15ffd22375af",
      "comment": "该 commit 实现了混合模型（full attention + mamba align）的细粒度部分前缀缓存命中。这是一个大型变更，涉及多个核心模块：1) CacheConfig 将 hash_block_size 重命名为 prefix_match_unit，语义更清晰；2) resolve_kv_cache_block_sizes 和 resolve_block_hashes 支持细粒度哈希查找；3) KVCacheCoordinator 新增 enable_partial_hash_hits 标志和 _cache_hit_alignment_tokens 属性；4) SingleTypeKVCacheManager 基类新增 supports_fine_grained_hash_lookup 类变量、_partial_hit_reqs 和 _pending_cow_copies 管理、_apply_cow 方法；5) FullAttentionManager 和 MambaManager 设置 supports_fine_grained_hash_lookup=True，并实现细粒度的 find_longest_cache_hit（支持 hash 边界级别的命中）；6) MambaManager 新增 _cache_partial_tail_block 方法，在 prompt 尾部注册部分缓存条目；7) BlockPool 新增 move_block_hashes 方法，用于 CoW 时移动哈希条目；8) Scheduler 新增 mamba_partial_cache_hit 标志和 _mamba_block_aligned_split 的细粒度分块逻辑；9) SchedulerOutput 新增 kv_cache_block_copies 字段；10) GPUModelRunner 在 update_requests 中应用 CoW 块复制；11) 新增 copy_kv_cache_blocks_inplace 工具函数；12) 新增大量测试用例。潜在风险：细粒度哈希查找增加了前缀缓存查找的复杂度；CoW 机制在并发场景下的正确性需要验证；deferred_frees 的 fence 逻辑需要确保块释放的时序正确。",
      "sig": "sig-core",
      "sig_reason": "（启发式迁移）按变更文件路径归类，可用 analyze_commits.py --force 重新分析。",
      "tags": [
        "feature",
        "high-risk",
        "scheduler",
        "kv-cache",
        "prefix-caching",
        "performance"
      ]
    },
    {
      "sha": "8e981630c9336233ca9de91452f68918bddbc4e2",
      "comment": "（自动判定）仅涉及 tests / docs / CI / 平台特化代码变更，不影响 vllm-ascend。",
      "sig": "sig-omni",
      "sig_reason": "（启发式迁移）按变更文件路径归类，可用 analyze_commits.py --force 重新分析。",
      "tags": [
        "bugfix",
        "low-risk"
      ]
    },
    {
      "sha": "9a48eef89a777fc7039d9765fb2f6fc618216948",
      "comment": "该 commit 修复了 LoRA 层中 _get_lora_device 函数对 ark_linear 基层的支持。当 base_layer 具有 ark_linear 属性时，从 base_layer.ark_linear.qweight 获取设备信息。同时新增了对应的单元测试。潜在风险：假设 ark_linear 一定具有 qweight 属性，如果某些变体没有该属性会报错。",
      "sig": "sig-core",
      "sig_reason": "（启发式迁移）按变更文件路径归类，可用 analyze_commits.py --force 重新分析。",
      "tags": [
        "bugfix",
        "low-risk",
        "lora"
      ]
    },
    {
      "sha": "1ef1c7ebba7f96d9835ade1fbd3658397e0b9be6",
      "comment": "（自动判定）仅涉及 tests / docs / CI / 平台特化代码变更，不影响 vllm-ascend。",
      "sig": "sig-ci",
      "sig_reason": "（启发式迁移）按变更文件路径归类，可用 analyze_commits.py --force 重新分析。",
      "tags": [
        "chore"
      ]
    }
  ]
}