{
  "date": "2026-06-19",
  "repo": "vllm-project/vllm",
  "generated_at": "2026-06-20T03:47:17.061423+08:00",
  "daily_summary": "当日变更主要集中在代码库基础设施重构、Bug修复和文档更新。核心变更包括：完成_C库内核迁移的最后阶段，将CUDA内核从旧的_C扩展迁移到_C_stable_libtorch，并将QuTLASS分离为独立扩展；修复了多个Bug，包括MoE FP8 LoRA导致输出损坏、MTP TopK索引共享、空工具块导致后续内容丢失、Mooncake TP put-striding在DCP>1时的键空间问题；优化了Mooncake KV连接器的异步查找以减少调度器开销；更新了LMCache文档和示例；清理了reasoning/模块中未使用的logger；为DeepSeek-V4的block-FP8共享专家支持TEP=16；为XPU升级了驱动和内核版本。",
  "sig_summaries": {
    "sig-core": "SIG Core 方向当日共 4 条变更。",
    "sig-large-scale-serving": "SIG Large Scale Serving 方向当日共 3 条变更。",
    "sig-model-performance": "SIG Model Performance 方向当日共 2 条变更。",
    "sig-ci": "SIG CI 方向当日共 2 条变更。",
    "sig-quantization": "SIG Quantization 方向当日共 1 条变更。",
    "sig-spec-decode": "SIG Spec Decode 方向当日共 1 条变更。",
    "sig-omni": "vLLM-Omni 方向当日共 1 条变更。"
  },
  "commits": [
    {
      "sha": "b9a7cd464c9ae9b1b450f8982b76d7be4de73724",
      "comment": "这是_C库内核迁移系列的最后一步。主要变更包括：1) 将CUDA的_C扩展构建限制为仅ROCm，CUDA的激活内核已迁移到_C_stable_libtorch；2) 将CUTLASS依赖从_C移动到_C_stable_libtorch；3) 将QuTLASS分离为独立的_qutlass_C扩展，因为其使用旧版ATen头文件无法与TORCH_TARGET_VERSION兼容；4) 将silu_and_mul_quant和persistent_masked_m_silu_mul_quant等量化激活内核从_C迁移到_C_stable_libtorch；5) 在CudaPlatformBase中添加import_kernels类方法，统一管理内核扩展导入；6) 修复了多个头文件包含路径。风险较低，因为这是迁移的最后一步，且保持了向后兼容性。",
      "sig": "sig-model-performance",
      "sig_reason": "（启发式迁移）按变更文件路径归类，可用 analyze_commits.py --force 重新分析。",
      "tags": [
        "refactor",
        "low-risk",
        "build-system",
        "cuda"
      ]
    },
    {
      "sha": "69bdd345428408a2fdf745e225c87defbc2c07d0",
      "comment": "修复了验证错误处理中param字段的填充问题。当Pydantic验证错误没有自定义VLLMValidationError上下文时，param字段会保持为None。此变更添加了回退逻辑：从Pydantic错误的loc字段提取参数名，格式化为点分隔的字符串（如'body.messages'）。同时处理了Schemathesis模糊测试发现的非字典错误情况。风险极低，仅影响错误响应格式。",
      "sig": "sig-core",
      "sig_reason": "（启发式迁移）按变更文件路径归类，可用 analyze_commits.py --force 重新分析。",
      "tags": [
        "bugfix",
        "low-risk",
        "api"
      ]
    },
    {
      "sha": "ec67d7ae619435f5f27279081f40e3a733ca9ab7",
      "comment": "为XPU平台升级了vllm-xpu-kernels到v0.1.10，并更新了Intel GPU驱动（UMD）到26.18版本。同时更新了文档，建议用户升级驱动以避免兼容性问题。在CI中忽略了一个新的测试文件。这是XPU平台的常规依赖升级，风险较低。",
      "sig": "sig-ci",
      "sig_reason": "（启发式迁移）按变更文件路径归类，可用 analyze_commits.py --force 重新分析。",
      "tags": [
        "chore",
        "low-risk",
        "xpu",
        "dependencies"
      ]
    },
    {
      "sha": "ecf9d83520eb217401b47d8a5451a27c5231b8c2",
      "comment": "（自动判定）仅涉及 tests / docs / CI / 平台特化代码变更，不影响 vllm-ascend。",
      "sig": "sig-ci",
      "sig_reason": "（启发式迁移）按变更文件路径归类，可用 analyze_commits.py --force 重新分析。",
      "tags": [
        "bugfix",
        "low-risk"
      ]
    },
    {
      "sha": "c9135db27cafb853af5e2cb86c1a0b3c6b5b8c91",
      "comment": "更新了LMCache的文档和示例代码。主要变更包括：1) 更新README.md，清晰区分了进程内模式（LMCacheConnectorV1）和多进程模式（LMCacheMPConnector）；2) 添加了cpu_offload_lmcache_mp.sh示例，展示如何使用--kv-offloading-backend lmcache快捷方式；3) 简化了cpu_offload_lmcache.py，移除了v0支持；4) 删除了过时的disagg_prefill_lmcache_v0.py；5) 移除了所有示例中的LMCACHE_USE_EXPERIMENTAL环境变量。风险极低，仅影响文档和示例。",
      "sig": "sig-large-scale-serving",
      "sig_reason": "（启发式迁移）按变更文件路径归类，可用 analyze_commits.py --force 重新分析。",
      "tags": [
        "docs",
        "low-risk",
        "kv-cache",
        "lmcache"
      ]
    },
    {
      "sha": "2a6c6b94293edb54bff8088a5d64b703aac187ff",
      "comment": "为DeepSeek-V4模型的block-FP8共享专家支持TEP=16。当使用block-FP8量化且非序列并行时，需要将intermediate_size向上取整到TP分片对齐的块大小，以确保每个rank获得偶数个128-block。在load_weights中添加了_pad_shared_expert_weight方法，对共享专家权重进行零填充。风险中等，因为修改了模型加载逻辑，但仅影响block-FP8量化且非SP的场景。",
      "sig": "sig-quantization",
      "sig_reason": "（启发式迁移）按变更文件路径归类，可用 analyze_commits.py --force 重新分析。",
      "tags": [
        "feature",
        "medium-risk",
        "deepseek-v4",
        "quantization",
        "model"
      ]
    },
    {
      "sha": "ab666069935c1f23e8ef56038b4659ac9e8f19f8",
      "comment": "修复了MTP（Multi-Token Prediction）推测解码中的索引器初始化和TopK共享问题。主要变更包括：1) 在deepseek_v2.py中重构了indexer初始化逻辑，支持skip pattern和MTP层；2) 在deepseek_mtp.py中修改forward方法，返回(hidden_states, recycled_hidden)元组；3) 在llm_base_proposer.py中为DeepSeekMTPModel设置model_returns_tuple=True；4) 在多个MLA稀疏注意力后端中添加topk_indices_buffer参数，支持backbone skip层共享缓冲区。风险中等，涉及多个模块的接口变更。",
      "sig": "sig-spec-decode",
      "sig_reason": "（启发式迁移）按变更文件路径归类，可用 analyze_commits.py --force 重新分析。",
      "tags": [
        "bugfix",
        "medium-risk",
        "speculative-decoding",
        "attention",
        "deepseek"
      ]
    },
    {
      "sha": "9ea3a4015b412d146d38ee1b697aafe92979c6ae",
      "comment": "修复了MoE FP8 LoRA导致输出损坏的Bug。问题根源在于：当LoRA被加载但当前批次不使用LoRA时，add_lora_fused_moe仍会调用LoRA内核，导致输出被错误修改。修复包括：1) 在punica_gpu.py的add_lora_fused_moe中添加早期退出，当no_lora_flag为True时直接返回；2) 在triton_moe.py中处理激活量化与LoRA的交互，确保LoRA shrink kernel使用未量化的激活值；3) 在modular_kernel.py中暂存原始未量化hidden states。风险中等，但修复逻辑清晰，测试覆盖充分。",
      "sig": "sig-model-performance",
      "sig_reason": "（启发式迁移）按变更文件路径归类，可用 analyze_commits.py --force 重新分析。",
      "tags": [
        "bugfix",
        "medium-risk",
        "lora",
        "moe",
        "quantization"
      ]
    },
    {
      "sha": "560fb8b867aaa444d471b35fd846368ebacf12b9",
      "comment": "删除了Cohere推理解析器中已废弃的prepare_structured_tag方法。该方法之前用于保留Cohere的structured_tag，但上游已修复了默认行为，不再需要此覆盖。风险极低。",
      "sig": "sig-core",
      "sig_reason": "（启发式迁移）按变更文件路径归类，可用 analyze_commits.py --force 重新分析。",
      "tags": [
        "refactor",
        "low-risk",
        "reasoning",
        "cohere"
      ]
    },
    {
      "sha": "675cd5d228869d152eba17526f1bef0b97f58ed8",
      "comment": "（自动判定）仅涉及 tests / docs / CI / 平台特化代码变更，不影响 vllm-ascend。",
      "sig": "sig-omni",
      "sig_reason": "（启发式迁移）按变更文件路径归类，可用 analyze_commits.py --force 重新分析。",
      "tags": [
        "bugfix",
        "low-risk"
      ]
    },
    {
      "sha": "7f616c327d24a259dd81605e513c42ce2b9dc204",
      "comment": "修复了空工具块导致后续内容被静默丢弃的Bug。当模型输出空工具调用（<tool_call></tool_call>）后跟文本内容时，parser_engine中的_deferred_content逻辑错误地抑制了后续内容。修复包括：1) 在parser_engine.py中，当seen_tool_event为True但tool_call_deltas为空时，仍应释放deferred content；2) 在qwen3.py和gemma4.py中添加TOOL_PREAMBLE到TOOL_END的转换，支持空工具块。风险较低。",
      "sig": "sig-core",
      "sig_reason": "（启发式迁移）按变更文件路径归类，可用 analyze_commits.py --force 重新分析。",
      "tags": [
        "bugfix",
        "low-risk",
        "parser",
        "tool-calls"
      ]
    },
    {
      "sha": "c3c6d723fdd1c315322e5d5a51c479eb2bc017a2",
      "comment": "清理了reasoning/模块中9个解析器文件里未使用的logger导入。这些logger变量被定义但从未使用，移除它们可以减少模块加载开销和代码冗余。风险极低。",
      "sig": "sig-core",
      "sig_reason": "（启发式迁移）按变更文件路径归类，可用 analyze_commits.py --force 重新分析。",
      "tags": [
        "refactor",
        "low-risk",
        "reasoning",
        "performance"
      ]
    },
    {
      "sha": "41dcf49ca52ab25178ca8869298275b1787f328a",
      "comment": "修复了Mooncake KV连接器在DCP（Decode Context Parallel）>1时的TP put-striding问题。当num_kv_head < tp_size时，TP rank会通过striding共享键命名空间。但在DCP>1时，每个rank使用不同的@dcpN命名空间，striding会导致某些键未被写入，GET时返回OBJECT_NOT_FOUND。修复添加了dcp_size <= 1的条件检查。风险较低，逻辑清晰。",
      "sig": "sig-large-scale-serving",
      "sig_reason": "（启发式迁移）按变更文件路径归类，可用 analyze_commits.py --force 重新分析。",
      "tags": [
        "bugfix",
        "low-risk",
        "kv-cache",
        "distributed",
        "mooncake"
      ]
    },
    {
      "sha": "35e4dd4a69b6b95feb74866341daa46c3836aed0",
      "comment": "为Mooncake KV连接器添加了异步查找功能，以减少调度器开销。主要变更包括：1) 在LookupKeyClient中添加ThreadPoolExecutor和futures字典，支持非阻塞查找；2) 在scheduler.py中添加lookup_async配置项，当启用时，get_num_new_matched_tokens返回(None, False)表示查找未就绪，调度器会在后续步骤重试；3) 添加discard方法用于清理已完成的查找结果；4) 更新了文档和测试。风险较低，因为异步查找是可选功能，默认关闭。",
      "sig": "sig-large-scale-serving",
      "sig_reason": "（启发式迁移）按变更文件路径归类，可用 analyze_commits.py --force 重新分析。",
      "tags": [
        "feature",
        "low-risk",
        "kv-cache",
        "performance",
        "mooncake"
      ]
    }
  ]
}